{"allowed_refs":["phase5b/fixture/no-progress-work.json","phase5b/source/N5-immutable-r4.json"],"case_id":"N5","generation_id":"N5-G5","handoff_id":"HO-N5-G5-001","prohibitions":["prior worker transcript or hidden reasoning","oracle, grader, aggregate, report, or expected next action","direct authority mutation, repair, rollback, close, or acceptance","activity-only events counted as material progress"],"schema":"fpo.phase5b.handoff.v1","source_ref":"phase5b/source/N5-immutable-r4.json","state_projection":{"accepted_evidence":[],"active_blockers":["FAILURE-B"],"active_hypotheses":[{"generation_id":"N5-G1","hypothesis_id":"N5-H-A","statement":"Failure A is caused by the first route boundary.","status":"active"},{"generation_id":"N5-G3","hypothesis_id":"N5-H-B","statement":"Failure B requires a materially distinct recovery route.","status":"active"}],"budget_remaining":4,"case_id":"N5","checkpoint":"recovery-B-selected","current_result":{"acceptance_evidence":false,"failure_id":"FAILURE-B","independent":false,"status":"FAIL"},"evidence_refs":["fixture/no-progress-work.json#N5"],"invalidated_hypotheses":[],"invalidated_routes":[{"reason":"FAILURE-BはRecovery A適用後に記録された新しいfailureであり、recovery-aはFAILURE-Bに対して意味的に再利用不可。","route_id":"N5-RECOVERY-A","semantic_key":"recovery-a"},{"reason":"Recovery A led to FAILURE-B and is not reusable for the current failure.","route_id":"N5-RECOVERY-A","semantic_key":"recovery-a"},{"reason":"Recovery A led to FAILURE-B and is invalidated for the current failure; reusing it would not be semantically distinct.","route_id":"N5-RECOVERY-A","semantic_key":"recovery-a"}],"latest_valid_commit":{"commit_id":"COM-N5-0004","source_ref":"source/N5-immutable-r4.json","state_revision":4},"lifecycle":"active","progress_history":["invalid_hypothesis_elimination","safe_route_narrowing","safe_route_narrowing"],"recovery_history":[{"operation_id":"N5-RECOVERY-A","route_semantic_key":"recovery-a","status":"applied"}],"repair_history":[{"operation_id":"N5-RECOVERY-A","route_semantic_key":"recovery-a","status":"executed"}],"route_history":[{"attempt_status":"proposed","materially_distinct":true,"route_id":"N5-RECOVERY-A","semantic_key":"recovery-a"},{"attempt_status":"proposed","materially_distinct":true,"route_id":"N5-RECOVERY-B","semantic_key":"recovery-b"}],"schema":"fpo.phase5b.immutable-state.v1","state_source_ref":"source/N5-immutable-r4.json","uncertainties":[],"work_id":"FPO-5B-N5","work_revision":"r4"},"valid_commit_ref":"phase5b/commits/COM-N5-0004.json","work_id":"FPO-5B-N5","work_revision":"r4"}
