{"allowed_refs":["phase5b/fixture/no-progress-work.json","phase5b/source/N3-immutable-r1.json"],"case_id":"N3","generation_id":"N3-G1","handoff_id":"HO-N3-G1-001","prohibitions":["prior worker transcript or hidden reasoning","oracle, grader, aggregate, report, or expected next action","direct authority mutation, repair, rollback, close, or acceptance","activity-only events counted as material progress"],"schema":"fpo.phase5b.handoff.v1","source_ref":"phase5b/source/N3-immutable-r1.json","state_projection":{"accepted_evidence":["evidence/EVD-N3-001.json"],"active_blockers":["checkpoint-held"],"active_hypotheses":[],"budget_remaining":2,"case_id":"N3","checkpoint":"diagnosis","current_result":{"acceptance_evidence":false,"failure_id":"N3-INITIAL","independent":false,"status":"FAIL"},"evidence_refs":["fixture/no-progress-work.json#N3"],"invalidated_hypotheses":[{"generation_id":"N3-G1","hypothesis_id":"N3-H-BAD","reason":"source evidence eliminated the broad hypothesis"}],"invalidated_routes":[],"latest_valid_commit":{"commit_id":"COM-N3-0001","source_ref":"source/N3-immutable-r1.json","state_revision":1},"lifecycle":"active","progress_history":["invalid_hypothesis_elimination","safe_route_narrowing","uncertainty_reduction"],"recovery_history":[],"repair_history":[],"route_history":[],"schema":"fpo.phase5b.immutable-state.v1","state_source_ref":"source/N3-immutable-r1.json","uncertainties":[{"status":"resolved","uncertainty_id":"N3-U-001"}],"work_id":"FPO-5B-N3","work_revision":"r1"},"valid_commit_ref":"phase5b/commits/COM-N3-0001.json","work_id":"FPO-5B-N3","work_revision":"r1"}
