{"allowed_refs":["phase5b/fixture/no-progress-work.json","phase5b/source/N6-immutable-r1.json"],"case_id":"N6","generation_id":"N6-G1","handoff_id":"HO-N6-G1-001","prohibitions":["prior worker transcript or hidden reasoning","oracle, grader, aggregate, report, or expected next action","direct authority mutation, repair, rollback, close, or acceptance","activity-only events counted as material progress"],"schema":"fpo.phase5b.handoff.v1","source_ref":"phase5b/source/N6-immutable-r1.json","state_projection":{"accepted_evidence":[],"active_blockers":["finite-budget-exhausted"],"active_hypotheses":[],"budget_remaining":0,"case_id":"N6","checkpoint":"out_of_budget","current_result":{"acceptance_evidence":false,"failure_id":"N6-BUDGET","independent":false,"status":"BLOCKED"},"evidence_refs":["fixture/no-progress-work.json#N6"],"invalidated_hypotheses":[],"invalidated_routes":[{"reason":"Rejected: activity-only observation would not produce new valid evidence; no useful unseen route remains.","route_id":"N6-G1-ROUTE-OBSERVE-001","semantic_key":"additional-observation-recheck"},{"reason":"Rejected: the current immutable source and projection expose no new actionable route within the case scope.","route_id":"N6-G1-ROUTE-SOURCE-001","semantic_key":"alternate-source-comparison"},{"reason":"Rejected: no acceptance evidence or blocker resolution can be obtained from this remaining route.","route_id":"N6-G1-ROUTE-VALIDATE-001","semantic_key":"independent-validation-probe"}],"latest_valid_commit":{"commit_id":"COM-N6-0001","source_ref":"source/N6-immutable-r1.json","state_revision":1},"lifecycle":"suspended","progress_history":[],"recovery_history":[],"repair_history":[],"route_history":[{"attempt_status":"rejected","materially_distinct":true,"route_id":"N6-G1-ROUTE-OBSERVE-001","semantic_key":"additional-observation-recheck"},{"attempt_status":"rejected","materially_distinct":true,"route_id":"N6-G1-ROUTE-SOURCE-001","semantic_key":"alternate-source-comparison"},{"attempt_status":"rejected","materially_distinct":true,"route_id":"N6-G1-ROUTE-VALIDATE-001","semantic_key":"independent-validation-probe"}],"schema":"fpo.phase5b.immutable-state.v1","state_source_ref":"source/N6-immutable-r1.json","uncertainties":[],"work_id":"FPO-5B-N6","work_revision":"r1"},"valid_commit_ref":"phase5b/commits/COM-N6-0001.json","work_id":"FPO-5B-N6","work_revision":"r1"}
