{"allowed_refs":["phase5b/fixture/no-progress-work.json","phase5b/source/N4-immutable-r0.json"],"case_id":"N4","generation_id":"N4-G1","handoff_id":"HO-N4-G1-001","prohibitions":["prior worker transcript or hidden reasoning","oracle, grader, aggregate, report, or expected next action","direct authority mutation, repair, rollback, close, or acceptance","activity-only events counted as material progress"],"schema":"fpo.phase5b.handoff.v1","source_ref":"phase5b/source/N4-immutable-r0.json","state_projection":{"accepted_evidence":[],"active_blockers":["repair-not-tried"],"active_hypotheses":[],"budget_remaining":3,"case_id":"N4","checkpoint":"known-good","current_result":{"acceptance_evidence":false,"failure_id":"N4-INITIAL","independent":false,"status":"FAIL"},"evidence_refs":["fixture/no-progress-work.json#N4"],"invalidated_hypotheses":[],"invalidated_routes":[],"latest_valid_commit":{"commit_id":"COM-N4-0000","source_ref":"source/N4-immutable-r0.json","state_revision":0},"lifecycle":"active","progress_history":[],"recovery_history":[],"repair_history":[],"route_history":[],"schema":"fpo.phase5b.immutable-state.v1","state_source_ref":"source/N4-immutable-r0.json","uncertainties":[],"work_id":"FPO-5B-N4","work_revision":"r0"},"valid_commit_ref":"phase5b/commits/COM-N4-0000.json","work_id":"FPO-5B-N4","work_revision":"r0"}
